表十三 2023年9月份全国进口商品贸易同比指数（HS2分类）,表十三 2023年9月份全国进口商品贸易同比指数（HS2分类）,表十三 2023年9月份全国进口商品贸易同比指数（HS2分类）,表十三 2023年9月份全国进口商品贸易同比指数（HS2分类）,表十三 2023年9月份全国进口商品贸易同比指数（HS2分类）
"Table 13 Index Number of Imports by HS2,Sept. 2023","Table 13 Index Number of Imports by HS2,Sept. 2023","Table 13 Index Number of Imports by HS2,Sept. 2023","Table 13 Index Number of Imports by HS2,Sept. 2023","Table 13 Index Number of Imports by HS2,Sept. 2023"
same month of last year = 100,same month of last year = 100,same month of last year = 100,same month of last year = 100,same month of last year = 100
HS编码 code,商品名称 Description,价格指数 Unit value,数量指数 Quantum,价值指数 Value
总指数,总指数,97.0,102.2,99.2
1类,第一类 活动物；动物产品,86.7,96.2,83.4
01,第1章活动物,74.1,34.6,25.7
02,第2章肉及食用杂碎,82.6,91.8,75.8
03,第3章鱼、甲壳动物、软体动物及其他水生无脊椎动物,90.6,105.4,95.5
04,第4章乳品；蛋品；天然蜂蜜；其他食用动物产品,94.6,94.7,89.5
05,第5章其他动物产品,84.4,96.1,81.1
2类,第二类 植物产品,88.9,106.7,94.9
06,第6章活树及其他活植物；鳞茎、根及类似品；插花及装饰用簇叶,109.3,122.8,134.3
07,第7章食用蔬菜、根及块茎,90.5,159.1,144.0
08,第8章食用水果及坚果；甜瓜或柑橘属水果的果皮,98.2,172.2,169.2
09,第9章咖啡、茶、马黛茶及调味香料,96.2,76.2,73.3
10,第10章谷物,90.2,102.3,92.3
11,第11章制粉工业产品；麦芽；淀粉；菊粉；面筋,110.8,97.0,107.5
12,第12章含油子仁及果实；杂项子仁及果仁；工业用或药用植物；稻草、秸秆及饲料,85.5,96.3,82.4
13,第13章虫胶；树胶、树脂及其他植物液、汁,86.1,99.0,85.3
14,第14章编结用植物材料；其他植物产品,96.9,101.2,98.1
3类,第三类 动、植物油、脂、蜡；精制食用油脂,80.4,113.9,91.5
15,第15章动、植物或微生物油、脂及其分解产品；精制的食用油脂；动、植物蜡,80.4,113.9,91.5
4类,第四类 食品；饮料、酒及醋；烟草及制品,113.8,85.5,97.2
16,第16章肉、鱼、甲壳动物、软体动物及其他水生无脊椎动物、昆虫的制品,77.1,234.0,180.3
17,第17章糖及糖食,126.8,85.8,108.8
18,第18章可可及可可制品,114.8,103.7,119.0
19,第19章谷物、粮食粉、淀粉或乳的制品；糕饼点心,113.6,75.9,86.1
20,第20章蔬菜、水果、坚果或植物其他部分的制品,104.5,82.0,85.7
21,第21章杂项食品,128.5,79.6,102.3
22,第22章饮料、酒及醋,109.2,104.3,113.9
23,第23章食品工业的残渣及废料；配制的动物饲料,103.6,77.6,80.3
24,第24章烟草、烟草及烟草代用品的制品；非经燃烧吸用的产品，不论是否含有尼古丁；其他供人体摄入尼古丁的含尼古丁的产品,110.1,96.0,105.7
5类,第五类 矿产品,93.4,114.8,107.2
25,第25章盐；硫磺；泥土及石料；石膏料、石灰及水泥,92.6,181.6,168.3
26,第26章矿砂、矿渣及矿灰,111.7,102.7,114.8
27,第27章矿物燃料、矿物油及其蒸馏产品；沥青物质；矿物蜡,86.6,118.2,102.4
6类,第六类 化学工业及其相关工业的产品,88.7,107.8,95.7
28,第28章无机化学品；贵金属、稀土金属、放射性元素及其同位素的有机及无机化合物,81.8,112.4,92.0
29,第29章有机化学品,98.6,92.6,91.3
30,第30章药品,82.7,137.9,114.0
31,第31章肥料,56.5,158.4,89.5
32,第32章鞣料浸膏及染料浸膏；鞣酸及其衍生物；染料、颜料及其他着色料；油漆及清漆；油灰及其他类似胶粘剂；墨水、油墨,100.6,105.7,106.3
33,第33章精油及香膏；芳香料制品及化妆盥洗品,88.9,91.8,81.6
34,第34章肥皂、有机表面活性剂、洗涤剂、润滑剂、人造蜡、调制蜡、光洁剂、蜡烛及类似品、塑型用膏、“牙科用蜡”及牙科用熟石膏制剂,103.5,87.1,90.2
35,第35章蛋白类物质；改性淀粉；胶；酶,95.2,107.6,102.4
36,第36章炸药；烟火制品；引火合金；易燃材料制品,117.9,59.3,69.9
37,第37章照相及电影用品,98.4,113.2,111.4
38,第38章杂项化学产品,85.8,108.3,92.9
7类,第七类 塑料及其制品；橡胶及其制品,93.1,97.7,91.0
39,第39章塑料及其制品,93.3,97.9,91.3
40,第40章橡胶及其制品,92.2,97.1,89.5
8类,第八类 革、毛皮及制品；箱包；肠线制品,114.0,99.8,113.8
41,第41章生皮（毛皮除外）及皮革,93.9,110.1,103.4
42,第42章皮革制品；鞍具及挽具；旅行用品、手提包及类似容器；动物肠线（蚕胶丝除外）制品,127.6,87.0,111.0
43,第43章毛皮、人造毛皮及其制品,102.0,184.4,188.1
9类,第九类 木及制品；木炭；软木；编结品,88.2,91.5,80.7
44,第44章木及木制品；木炭,88.1,91.4,80.6
45,第45章软木及软木制品,146.0,105.5,154.1
46,第46章稻草、秸秆、针茅或其他编结材料制品；篮筐及柳条编结品,139.1,72.7,101.2
10类,第十类 木浆等；废纸；纸、纸板及其制品,73.6,121.9,89.7
47,第47章木浆及其他纤维状纤维素浆；回收（废碎）纸及纸板,69.7,128.3,89.5
48,第48章纸及纸板；纸浆、纸或纸板制品,85.9,121.7,104.5
49,第49章书籍、报纸、印刷图画及其他印刷品；手稿、打字稿及设计图纸,109.2,55.1,60.1
11类,第十一类 纺织原料及纺织制品,94.4,121.5,114.7
50,第50章蚕丝,114.3,77.0,88.0
51,第51章羊毛、动物细毛或粗毛；马毛纱线及其机织物,86.9,81.0,70.4
52,第52章棉花,84.0,232.5,195.2
53,第53章其他植物纺织纤维；纸纱线及其机织物,140.6,108.0,151.9
54,第54章化学纤维长丝；化学纤维纺织材料制扁条及类似品,101.3,112.3,113.7
55,第55章化学纤维短纤,100.3,98.3,98.6
56,第56章絮胎、毡呢及无纺织物；特种纱线；线、绳、索、缆及其制品,102.6,92.4,94.9
57,第57章地毯及纺织材料的其他铺地制品,84.7,123.0,104.2
58,第58章特种机织物；簇绒织物；花边；装饰毯；装饰带；刺绣品,106.9,78.3,83.7
59,第59章浸渍、涂布、包覆或层压的纺织物；工业用纺织制品,104.0,89.7,93.4
60,第60章针织物及钩编织物,107.2,77.4,82.9
61,第61章针织或钩编的服装及衣着附件,94.4,93.9,88.6
62,第62章非针织或非钩编的服装及衣着附件,98.7,91.8,90.5
63,第63章其他纺织制成品；成套物品；旧衣着及旧纺织品；碎织物,102.3,81.7,83.6
12类,第十二类 鞋帽伞等；羽毛品；人造花；人发品,102.6,103.8,106.6
64,第64章鞋靴、护腿和类似品及其零件,107.5,94.5,101.6
65,第65章帽类及其零件,77.9,146.6,114.2
66,第66章雨伞、阳伞、手杖、鞭子、马鞭及其零件,94.6,83.1,78.6
67,第67章已加工羽毛、羽绒及其制品；人造花；人发制品,83.4,165.0,137.7
13类,第十三类 矿物材料制品；陶瓷品；玻璃及制品,112.1,84.7,94.9
68,第68章石料、石膏、水泥、石棉、云母及类似材料的制品,111.5,84.4,94.1
69,第69章陶瓷产品,123.3,84.8,104.5
70,第70章玻璃及其制品,109.6,85.0,93.2
14类,第十四类 珠宝、贵金属及制品；仿首饰；硬币,117.6,79.8,93.9
71,第71章天然或养殖珍珠、宝石或半宝石、贵金属、包贵金属及其制品；仿首饰；硬币,117.6,79.8,93.9
15类,第十五类 贱金属及其制品,101.2,99.8,100.9
72,第72章钢铁,90.5,100.7,91.1
73,第73章钢铁制品,113.7,95.6,108.7
74,第74章铜及其制品,112.5,95.2,107.1
75,第75章镍及其制品,90.0,94.8,85.3
76,第76章铝及其制品,99.9,125.2,125.1
78,第78章铅及其制品,103.9,99.6,103.5
79,第79章锌及其制品,83.2,518.7,431.8
80,第80章锡及其制品,117.1,100.4,117.5
81,第81章其他贱金属、金属陶瓷及其制品,63.2,102.1,64.5
82,第82章贱金属工具、器具、利口器、餐匙、餐叉及其零件,103.8,85.5,88.8
83,第83章贱金属杂项制品,109.3,83.5,91.3
16类,第十六类 机电、音像设备及其零件、附件,100.5,95.7,96.1
84,第84章核反应堆、锅炉、机器、机械器具及零件,104.5,110.7,115.7
85,第85章电机、电气设备及其零件；录音机及放声机、电视图像、声音的录制和重放设备及其零件、附件,99.5,90.9,90.4
17类,第十七类 车辆、航空器、船舶及运输设备,108.5,92.4,100.2
86,第86章铁道及电车道机车、车辆及其零件；铁道及电车道轨道固定装置及其零件；附件；各种机械（包括电动机械）交通信号设备,128.0,78.8,100.9
87,第87章车辆及其零件、附件，但铁道及电车道车辆除外,108.0,92.0,99.4
88,第88章航空器、航天器及其零件,119.8,81.9,98.2
89,第89章船舶及浮动结构体,86.4,750.7,648.9
18类,第十八类 光学、医疗等仪器；钟表；乐器,101.2,97.2,98.4
90,第90章光学、照相、电影、计量、检验、医疗或外科用仪器及设备、精密仪器及设备；上述物品的零件、附件,100.1,98.1,98.3
91,第91章钟表及其零件,113.3,88.7,100.6
92,第92章乐器及其零件、附件,127.0,73.5,93.4
19类,第十九类 武器、弹药及其零件、附件,99.3,645.8,641.2
93,第93章武器、弹药及其零件、附件,99.3,645.8,641.2
20类,第二十类 杂项制品,102.4,92.3,94.6
94,第94章家具；寝具、褥垫、弹簧床垫、软坐垫及类似的填充制品；未列名灯具及照明装置；发光标志、发光铭牌及类似品；活动房屋,109.5,89.7,98.3
95,第95章玩具、游戏品、运动用品及其零件、附件,92.7,94.7,87.8
96,第96章杂项制品,107.6,93.9,101.1
21类,第二十一类 艺术品、收藏品及古物,68.1,428.9,292.2
97,第97章艺术品、收藏品及古物,68.1,428.9,292.2
98,第98章特殊交易品及未分类商品,113.0,120.9,136.6
